{
  "id": "rec:miles-davis-agharta-1975",
  "title": "Agharta",
  "artist": "Miles Davis",
  "year": 1975,
  "type": "album",
  "style_ids": ["style:jazz-fusion"],
  "drum_performances": [
    {
      "drummer_id": "drummer:al-foster",
      "name": "Al Foster",
      "drummer_role": "sole_drummer",
      "significance": 0.7,
      "why_it_matters": "Electric Miles, live in Osaka.",
      "evidence": {
        "confidence": "widely_reported",
        "source_ids": ["src:al-foster-wikipedia"]
      }
    }
  ],
  "tracks": [
    {
      "title": "Prelude",
      "drummer_ids": ["drummer:al-foster"],
      "drums": {
        "description": "A relentless, funk-rock ride and hi-hat groove held for long stretches under Miles' electric band's improvisation.",
        "evidence": {
          "confidence": "likely",
          "source_ids": ["src:agharta-album-wikipedia"]
        }
      },
      "youtube": "https://www.youtube.com/watch?v=DUR6zK9XcaM"
    },
    {
      "title": "Maiysha",
      "drummer_ids": ["drummer:al-foster"],
      "drums": {
        "description": "Light, Latin-tinged groove that moves into heavy funk.",
        "evidence": {
          "confidence": "likely",
          "source_ids": ["src:agharta-album-wikipedia"]
        }
      },
      "youtube": "https://www.youtube.com/watch?v=7aQN6ozACk8",
      "transcriptions": [
        {
          "site": "songsterr",
          "url": "https://www.songsterr.com/a/wa/song?id=6524034"
        }
      ]
    }
  ],
  "evidence": {
    "confidence": "widely_reported",
    "source_ids": ["src:al-foster-wikipedia"]
  }
}
