{
  "id": "rec:james-taylor-never-die-young-1988",
  "title": "Never Die Young",
  "artist": "James Taylor",
  "year": 1988,
  "type": "album",
  "style_ids": ["style:folk-rock"],
  "evidence": {
    "confidence": "widely_reported",
    "source_ids": ["src:carlos-vega-wikipedia"]
  },
  "drum_performances": [
    {
      "drummer_id": "drummer:carlos-vega",
      "name": "Carlos Vega",
      "drummer_role": "sole_drummer"
    }
  ],
  "tracks": [
    {
      "title": "Never Die Young",
      "drummer_ids": ["drummer:carlos-vega"],
      "drums": {
        "description": "A relaxed, flowing groove with light ghost notes under the acoustic guitar.",
        "evidence": {
          "confidence": "likely",
          "source_ids": ["src:never-die-young-wikipedia"]
        }
      },
      "youtube": "https://www.youtube.com/watch?v=FbGrD4hxoBI",
      "transcriptions": [
        {
          "site": "songsterr",
          "url": "https://www.songsterr.com/a/wa/song?id=200688"
        }
      ]
    }
  ]
}
