{
  "id": "rec:peter-brotzmann-die-like-a-dog-fragments-of-music-life-and-death-of-albert-ayler-1994",
  "title": "Die Like a Dog: Fragments of Music, Life and Death of Albert Ayler",
  "artist": "Peter Brötzmann",
  "year": 1994,
  "type": "album",
  "style_ids": ["style:free-jazz"],
  "drum_performances": [
    {
      "drummer_id": "drummer:hamid-drake",
      "name": "Hamid Drake",
      "drummer_role": "sole_drummer",
      "significance": 0.7,
      "why_it_matters": "The quartet with William Parker.",
      "evidence": {
        "confidence": "widely_reported",
        "source_ids": ["src:hamid-drake-wikipedia"]
      }
    }
  ],
  "evidence": {
    "confidence": "widely_reported",
    "source_ids": ["src:hamid-drake-wikipedia"]
  }
}
